<?xml version="1.0" encoding="UTF-8"?>
<xs:schema xmlns:xs="http://www.w3.org/2001/XMLSchema" elementFormDefault="qualified">

    <xs:element name="QLBD">
        <xs:complexType>
            <xs:sequence>
                <xs:element name="TINH" maxOccurs="unbounded">
                    <xs:complexType>
                        <xs:sequence>
                            <xs:element name="MATINH">
                                <xs:simpleType>
                                    <xs:restriction base="xs:string">
                                        <xs:maxLength value="10"/>
                                    </xs:restriction>
                                </xs:simpleType>
                            </xs:element>
                            <xs:element name="TENTINH">
                                <xs:simpleType>
                                    <xs:restriction base="xs:string">
                                        <xs:maxLength value="50"/>
                                    </xs:restriction>
                                </xs:simpleType>
                            </xs:element>
                        </xs:sequence>
                    </xs:complexType>
                </xs:element>
                <xs:element name="SANVD" maxOccurs="unbounded">
                    <xs:complexType>
                        <xs:sequence>
                            <xs:element name="MASAN">
                                <xs:simpleType>
                                    <xs:restriction base="xs:string">
                                        <xs:maxLength value="10"/>
                                    </xs:restriction>
                                </xs:simpleType>
                            </xs:element>
                            <xs:element name="TENSAN">
                                <xs:simpleType>
                                    <xs:restriction base="xs:string">
                                        <xs:maxLength value="50"/>
                                    </xs:restriction>
                                </xs:simpleType>
                            </xs:element>
                            <xs:element name="DIACHI">
                                <xs:simpleType>
                                    <xs:restriction base="xs:string">
                                        <xs:maxLength value="100"/>
                                    </xs:restriction>
                                </xs:simpleType>
                            </xs:element>
                        </xs:sequence>
                    </xs:complexType>
                </xs:element>
                <xs:element name="QUOCGIA" maxOccurs="unbounded">
                    <xs:complexType>
                        <xs:sequence>
                            <xs:element name="MAQG">
                                <xs:simpleType>
                                    <xs:restriction base="xs:string">
                                        <xs:maxLength value="10"/>
                                    </xs:restriction>
                                </xs:simpleType>
                            </xs:element>
                            <xs:element name="TENQG">
                                <xs:simpleType>
                                    <xs:restriction base="xs:string">
                                        <xs:maxLength value="50"/>
                                    </xs:restriction>
                                </xs:simpleType>
                            </xs:element>
                        </xs:sequence>
                    </xs:complexType>
                </xs:element>
                <xs:element name="CAULACBO" maxOccurs="unbounded">
                    <xs:complexType>
                        <xs:sequence>
                            <xs:element name="MACLB">
                                <xs:simpleType>
                                    <xs:restriction base="xs:string">
                                        <xs:maxLength value="10"/>
                                    </xs:restriction>
                                </xs:simpleType>
                            </xs:element>
                            <xs:element name="TENCLB">
                                <xs:simpleType>
                                    <xs:restriction base="xs:string">
                                        <xs:maxLength value="50"/>
                                    </xs:restriction>
                                </xs:simpleType>
                            </xs:element>
                            <xs:element name="MASAN">
                                <xs:simpleType>
                                    <xs:restriction base="xs:string">
                                        <xs:maxLength value="10"/>
                                    </xs:restriction>
                                </xs:simpleType>
                            </xs:element>
                            <xs:element name="MATINH">
                                <xs:simpleType>
                                    <xs:restriction base="xs:string">
                                        <xs:maxLength value="10"/>
                                    </xs:restriction>
                                </xs:simpleType>
                            </xs:element>
                        </xs:sequence>
                    </xs:complexType>
                </xs:element>
                <xs:element name="CAUTHU" maxOccurs="unbounded">
                    <xs:complexType>
                        <xs:sequence>
                            <xs:element name="MACT">
                                <xs:simpleType>
                                    <xs:restriction base="xs:string">
                                        <xs:maxLength value="10"/>
                                    </xs:restriction>
                                </xs:simpleType>
                            </xs:element>
                            <xs:element name="HOTEN">
                                <xs:simpleType>
                                    <xs:restriction base="xs:string">
                                        <xs:maxLength value="50"/>
                                    </xs:restriction>
                                </xs:simpleType>
                            </xs:element>
                            <xs:element name="VITRI">
                                <xs:simpleType>
                                    <xs:restriction base="xs:string">
                                        <xs:maxLength value="50"/>
                                    </xs:restriction>
                                </xs:simpleType>
                            </xs:element>
                            <xs:element name="NGAYSINH" type="xs:date"/>
                            <xs:element name="DIACHI">
                                <xs:simpleType>
                                    <xs:restriction base="xs:string">
                                        <xs:maxLength value="100"/>
                                    </xs:restriction>
                                </xs:simpleType>
                            </xs:element>
                            <xs:element name="MACLB">
                                <xs:simpleType>
                                    <xs:restriction base="xs:string">
                                        <xs:maxLength value="10"/>
                                    </xs:restriction>
                                </xs:simpleType>
                            </xs:element>
                            <xs:element name="MAQG">
                                <xs:simpleType>
                                    <xs:restriction base="xs:string">
                                        <xs:maxLength value="10"/>
                                    </xs:restriction>
                                </xs:simpleType>
                            </xs:element>
                            <xs:element name="SO" type="xs:int"/>
                        </xs:sequence>
                    </xs:complexType>
                </xs:element>
                <xs:element name="HLV" maxOccurs="unbounded">
                    <xs:complexType>
                        <xs:sequence>
                            <xs:element name="MAHLV">
                                <xs:simpleType>
                                    <xs:restriction base="xs:string">
                                        <xs:maxLength value="10"/>
                                    </xs:restriction>
                                </xs:simpleType>
                            </xs:element>
                            <xs:element name="TENHLV">
                                <xs:simpleType>
                                    <xs:restriction base="xs:string">
                                        <xs:maxLength value="50"/>
                                    </xs:restriction>
                                </xs:simpleType>
                            </xs:element>
                            <xs:element name="NGAYSINH" type="xs:date"/>
                            <xs:element name="DIACHI">
                                <xs:simpleType>
                                    <xs:restriction base="xs:string">
                                        <xs:maxLength value="100"/>
                                    </xs:restriction>
                                </xs:simpleType>
                            </xs:element>
                            <xs:element name="DIENTHOAI">
                                <xs:simpleType>
                                    <xs:restriction base="xs:string">
                                        <xs:maxLength value="11"/>
                                    </xs:restriction>
                                </xs:simpleType>
                            </xs:element>
                            <xs:element name="MAQG">
                                <xs:simpleType>
                                    <xs:restriction base="xs:string">
                                        <xs:maxLength value="10"/>
                                    </xs:restriction>
                                </xs:simpleType>
                            </xs:element>
                        </xs:sequence>
                    </xs:complexType>
                </xs:element>
                <xs:element name="HLV_CLB" maxOccurs="unbounded">
                    <xs:complexType>
                        <xs:sequence>
                            <xs:element name="MAHLV">
                                <xs:simpleType>
                                    <xs:restriction base="xs:string">
                                        <xs:maxLength value="10"/>
                                    </xs:restriction>
                                </xs:simpleType>
                            </xs:element>
                            <xs:element name="MACLB">
                                <xs:simpleType>
                                    <xs:restriction base="xs:string">
                                        <xs:maxLength value="10"/>
                                    </xs:restriction>
                                </xs:simpleType>
                            </xs:element>
                            <xs:element name="VAITRO">
                                <xs:simpleType>
                                    <xs:restriction base="xs:string">
                                        <xs:maxLength value="50"/>
                                    </xs:restriction>
                                </xs:simpleType>
                            </xs:element>
                        </xs:sequence>
                    </xs:complexType>
                </xs:element>
                <xs:element name="TRANDAU" maxOccurs="unbounded">
                    <xs:complexType>
                        <xs:sequence>
                            <xs:element name="MATRAN">
                                <xs:simpleType>
                                    <xs:restriction base="xs:string">
                                        <xs:maxLength value="10"/>
                                    </xs:restriction>
                                </xs:simpleType>
                            </xs:element>
                            <xs:element name="NAM">
                                <xs:simpleType>
                                    <xs:restriction base="xs:string">
                                        <xs:maxLength value="10"/>
                                    </xs:restriction>
                                </xs:simpleType>
                            </xs:element>
                            <xs:element name="NGAYTD" type="xs:date"/>
                            <xs:element name="VONG" type="xs:int"/>
                            <xs:element name="MACLB1">
                                <xs:simpleType>
                                    <xs:restriction base="xs:string">
                                        <xs:maxLength value="10"/>
                                    </xs:restriction>
                                </xs:simpleType>
                            </xs:element>
                            <xs:element name="MACLB2">
                                <xs:simpleType>
                                    <xs:restriction base="xs:string">
                                        <xs:maxLength value="10"/>
                                    </xs:restriction>
                                </xs:simpleType>
                            </xs:element>
                            <xs:element name="MASAN">
                                <xs:simpleType>
                                    <xs:restriction base="xs:string">
                                        <xs:maxLength value="10"/>
                                    </xs:restriction>
                                </xs:simpleType>
                            </xs:element>
                            <xs:element name="KETQUA">
                                <xs:simpleType>
                                    <xs:restriction base="xs:string">
                                        <xs:maxLength value="50"/>
                                    </xs:restriction>
                                </xs:simpleType>
                            </xs:element>
                        </xs:sequence>
                    </xs:complexType>
                </xs:element>
                <xs:element name="BANGXH" maxOccurs="unbounded">
                    <xs:complexType>
                        <xs:sequence>
                            <xs:element name="MACLB">
                                <xs:simpleType>
                                    <xs:restriction base="xs:string">
                                        <xs:maxLength value="10"/>
                                    </xs:restriction>
                                </xs:simpleType>
                            </xs:element>
                            <xs:element name="NAM">
                                <xs:simpleType>
                                    <xs:restriction base="xs:string">
                                        <xs:maxLength value="10"/>
                                    </xs:restriction>
                                </xs:simpleType>
                            </xs:element>
                            <xs:element name="VONG" type="xs:int"/>
                            <xs:element name="SOTRAN" type="xs:int"/>
                            <xs:element name="THANG" type="xs:int"/>
                            <xs:element name="HOA" type="xs:int"/>
                            <xs:element name="THUA" type="xs:int"/>
                            <xs:element name="DIEM" type="xs:int"/>
                            <xs:element name="HIEUSO">
                                <xs:simpleType>
                                    <xs:restriction base="xs:string">
                                        <xs:maxLength value="50"/>
                                    </xs:restriction>
                                </xs:simpleType>
                            </xs:element>
                            <xs:element name="HANG" type="xs:int"/>
                        </xs:sequence>
                    </xs:complexType>
                </xs:element>
            </xs:sequence>
        </xs:complexType>
        <xs:key name="CAUTHU_KEY">
            <xs:selector xpath="CAUTHU"/>
            <xs:field xpath="MACT"/>
        </xs:key>
        <xs:key name="QUOCGIA_KEY">
            <xs:selector xpath="QUOCGIA"/>
            <xs:field xpath="MAQG"/>
        </xs:key>
        <xs:key name="CAULACBO_KEY">
            <xs:selector xpath="CAULACBO"/>
            <xs:field xpath="MACLB"/>
        </xs:key>
        <xs:key name="TINH_KEY">
            <xs:selector xpath="TINH"/>
            <xs:field xpath="MATINH"/>
        </xs:key>
        <xs:key name="SANVD_KEY">
            <xs:selector xpath="SANVD"/>
            <xs:field xpath="MASAN"/>
        </xs:key>
        <xs:key name="HUANLUYENVIEN_KEY">
            <xs:selector xpath="HLV"/>
            <xs:field xpath="MAHLV"/>
        </xs:key>
        <xs:key name="HLV_CLB_KEY">
            <xs:selector xpath="HLV_CLB"/>
            <xs:field xpath="MAHLV"/>
        </xs:key>
        <xs:key name="TRANDAU_KEY">
            <xs:selector xpath="TRANDAU"/>
            <xs:field xpath="MATRAN"/>
        </xs:key>
        <xs:key name="BANGXH_KEY">
            <xs:selector xpath="BANGXH"/>
            <xs:field xpath="MACLB"/>
            <xs:field xpath="NAM"/>
            <xs:field xpath="VONG"/>
        </xs:key>
        <xs:keyref name="CAUTHU_REF1" refer="CAULACBO_KEY">
            <xs:selector xpath="CAULACBO"/>
            <xs:field xpath="MACLB"/>
        </xs:keyref>
        <xs:keyref name="CAUTHU_REF2" refer="QUOCGIA_KEY">
            <xs:selector xpath="QUOCGIA"/>
            <xs:field xpath="MAQG"/>
        </xs:keyref>
        <xs:keyref name="CAULACBO_REF" refer="SANVD_KEY">
            <xs:selector xpath="SANVD"/>
            <xs:field xpath="MASAN"/>
        </xs:keyref>
        <xs:keyref name="CAULACBO_REF2" refer="TINH_KEY">
            <xs:selector xpath="TINH"/>
            <xs:field xpath="MATINH"/>
        </xs:keyref>
        <xs:keyref name="HUANLUYENVIEN_REF" refer="QUOCGIA_KEY">
            <xs:selector xpath="QUOCGIA"/>
            <xs:field xpath="MAQG"/>
        </xs:keyref>
        <xs:keyref name="HLV_CLB_REF1" refer="HUANLUYENVIEN_KEY">
            <xs:selector xpath="HLV"/>
            <xs:field xpath="MAHLV"/>
        </xs:keyref>
        <xs:keyref name="HLV_CLB_REF2" refer="CAULACBO_KEY">
            <xs:selector xpath="CAULACBO"/>
            <xs:field xpath="MACLB"/>
        </xs:keyref>
        <xs:keyref name="TRANDAU_REF" refer="SANVD_KEY">
            <xs:selector xpath="SANVD"/>
            <xs:field xpath="MASAN"/>
        </xs:keyref>
        <xs:keyref name="BANGXH_REF" refer="CAULACBO_KEY">
            <xs:selector xpath="CAULACBO"/>
            <xs:field xpath="MACLB"/>
        </xs:keyref>
        <xs:unique name="TenSanUnique">
            <xs:selector xpath="SANVD"/>
            <xs:field xpath="TENSAN"/>
        </xs:unique>
        <xs:keyref name="TRANDAU_REF2" refer="CAULACBO_KEY">
            <xs:selector xpath="CAULACBO"/>
            <xs:field xpath="MACLB"/>
        </xs:keyref>
    </xs:element>
</xs:schema>
