<?xml version="1.0" encoding="utf-8"?>
<QLBD xmlns:xsi="http://www.w3.org/2001/XMLSchema-instance" xsi:noNamespaceSchemaLocation="QLBD.xsd">
  <TINH>
    <MATINH>T1</MATINH>
    <TENTINH>Tinh 1</TENTINH>
  </TINH>
  <SANVD>
    <MASAN>San01</MASAN>
    <TENSAN>Hoàng Anh</TENSAN>
    <DIACHI>S1</DIACHI>
  </SANVD>
  <QUOCGIA>
    <MAQG>QG1</MAQG>
    <TENQG>Viet Na</TENQG>
  </QUOCGIA>
  <QUOCGIA>
    <MAQG>QG2</MAQG>
    <TENQG>Trung quoc</TENQG>
  </QUOCGIA>
  <CAULACBO>
    <MACLB>CLB1</MACLB>
    <TENCLB>cau lac bo 1</TENCLB>
    <MASAN>S1</MASAN>
    <MATINH>T1</MATINH>
  </CAULACBO>
  <CAULACBO>
    <MACLB>CLB2</MACLB>
    <TENCLB>cau lac bo 2</TENCLB>
    <MASAN>S1</MASAN>
    <MATINH>T1</MATINH>
  </CAULACBO>
  <CAUTHU>
    <MACT>CT1</MACT>
    <HOTEN>Nguyen tien linh</HOTEN>
    <VITRI>Tien dao</VITRI>
    <NGAYSINH>2000-11-01</NGAYSINH>
    <DIACHI>Nha TRang</DIACHI>
    <MACLB>CLB1</MACLB>
    <MAQG>QG1</MAQG>
    <SO>01</SO>
  </CAUTHU>
  <CAUTHU>
    <MACT>CT4</MACT>
    <HOTEN>Tien dao</HOTEN>
    <VITRI>Nguyen tien linh</VITRI>
    <NGAYSINH>2001-02-11</NGAYSINH>
    <DIACHI>Nha TRang</DIACHI>
    <MACLB>CLB1</MACLB>
    <MAQG>QG2</MAQG>
    <SO>02</SO>
  </CAUTHU>
  <HLV>
    <MAHLV>HLV14</MAHLV>
    <TENHLV>nguyen ngoc y</TENHLV>
    <NGAYSINH>2001-07-11</NGAYSINH>
    <DIACHI>nha</DIACHI>
    <DIENTHOAI>alo</DIENTHOAI>
    <MAQG>QG1</MAQG>
  </HLV>
  <HLV>
    <MAHLV>12</MAHLV>
    <TENHLV>t</TENHLV>
    <NGAYSINH>2001-08-12</NGAYSINH>
    <DIACHI>2</DIACHI>
    <DIENTHOAI>09090</DIENTHOAI>
    <MAQG>QG2</MAQG>
  </HLV>
  <HLV_CLB>
    <MAHLV>HLV1</MAHLV>
    <MACLB>CLB1</MACLB>
    <VAITRO>chiu</VAITRO>
  </HLV_CLB>
  <HLV_CLB>
    <MAHLV></MAHLV>
    <MACLB></MACLB>
    <VAITRO>KHONG KHI</VAITRO>
  </HLV_CLB>
  <TRANDAU>
    <MATRAN>m1</MATRAN>
    <NAM>2000</NAM>
    <NGAYTD>2000-11-02</NGAYTD>
    <VONG>1</VONG>
    <MACLB1>CLB1</MACLB1>
    <MACLB2>CLB1</MACLB2>
    <MASAN>S1</MASAN>
    <KETQUA>2 0</KETQUA>
  </TRANDAU>
  <BANGXH>
    <MACLB>CLB1</MACLB>
    <NAM>200</NAM>
    <VONG>1</VONG>
    <SOTRAN>1</SOTRAN>
    <THANG>1</THANG>
    <HOA>0</HOA>
    <THUA>0</THUA>
    <DIEM>1</DIEM>
    <HIEUSO>1</HIEUSO>
    <HANG>1</HANG>
  </BANGXH>
</QLBD>